https://contents.goodfortune.jp/chiki/,核心見抜く掟破りの的中率！　冬月式【極】算命学
https://contents.goodfortune.jp/sashat/,心震わす真実の声に誰もが驚愕◆涙占い大阪の嬢王 SASHA.t
https://contents.goodfortune.jp/mokuren/,言霊に宿る真実を呼び覚ます　言霊ナース占い師目連
https://contents.goodfortune.jp/dyg/,占い系YouTuber◆心震わすROCKな魂「ダイヤング・タロット」
https://contents.goodfortune.jp/mian/,心揺さぶる高次元パワー解禁！　門外不出の琉球イーチンタロット美杏
https://contents.goodfortune.jp/maril/,大地の霊力であなたに幸せを引き寄せる～水萌マリルの龍脈ジオマンシー
https://contents.goodfortune.jp/kasya/,過去を再創造し運命を変える魔術◆ミセス・カーシャのパラレルリーディング
https://contents.goodfortune.jp/keit/,どんな悩みもカルマ音階で即解消！　野森ケイトの『アイリッシュハープ神秘術』
https://contents.goodfortune.jp/niu/,衝撃鑑定にドキッ！　霊性チャネラー“丹生灯香”の星辰波動占術
https://contents.goodfortune.jp/hayuki/,現実世界から徹底的にあなたを救う◆はゆき咲くらの「夢霊術クレアボヤンス」
https://contents.goodfortune.jp/mikomaria/,巫女マリアの“スピリチュアルインナーサイン”～内在するカルマの識別信号
https://contents.goodfortune.jp/reirin/,全てお見通し！　高次元チャネラー“れいりん”の不動明王チャネリング霊術
https://contents.goodfortune.jp/aron/,波動気学で悩めるあなたを救う！　“帝劇ビル地下の運命支配人”アロン
https://contents.goodfortune.jp/renri/,麻布にこの人あり！　お忍び芸能人&財界からも口コミ伝搬【麻布十番の母】
https://contents.goodfortune.jp/tsukikage/,貴女の影を認め心に輝きを取り戻す！　月影ひびきのマインドキューブ霊魔術
https://contents.goodfortune.jp/ensei/,邪気を祓い、不幸よ退散！　聖地奄美大島の“ユタ神様”円聖修の輪華霊術
https://contents.goodfortune.jp/jose/,鳥肌ドキッ！　驚愕の霊能力であなたの悩みをとり払う！～新大久保の霊能母
https://contents.goodfortune.jp/kairi/,月魔術で極当て鑑定！　七海カイリの“ダークムーン＆ホワイトムーン”
https://contents.goodfortune.jp/syuki/,陰の宇宙カルマを大転換！　レイキで邪を葬る“沖縄の太陽女史”YUKI
https://contents.goodfortune.jp/hakuryu/,神をも恐れぬ台湾随一の的中占！　台湾の諸葛孔明“白龍”の【八龍霊視占】
https://contents.goodfortune.jp/hoshikaze/,真髄解決!!　門外不出のマジナヒ祈祷　星風の“形代禁厭霊術”
https://contents.goodfortune.jp/etenmei/,前世からの因縁を宿したDNAを波動転換！　エト天命の前世波動呪術
https://contents.goodfortune.jp/koyanagi/,奇跡体験を起こしまくる霊魔術！　小柳猛のホワイトマジックリーディング
https://contents.goodfortune.jp/lumiko/,ゾクッ！とする程の《呪・縛・解・放・感》波動カバラ呪術師ＬＵＭＩＫＯ
https://contents.goodfortune.jp/aizuki/,ゾクッとする程、当てまくる！前世と現世をつなぐ脅威の霊界人～赤い糸の母
https://contents.goodfortune.jp/asuru/,怖い程当たる！小さなおじさんからの不思議託宣〜オールドマンオラクル
https://contents.goodfortune.jp/tomoko/,夜見の国の使者“智子”数霊万葉占術〜数霊の見えざる力で運命が激変〜
https://contents.goodfortune.jp/noda/,瀬戸の的中僧 “野田御前”の【六壬若水霊占】〜神が宿る門外不出鑑定
https://contents.goodfortune.jp/okac/,極上＊意識レベルの神鑑定！〜龍神様から選ばれた男“おかちゃん”
https://contents.goodfortune.jp/matsuyama/,あなたの苦境を激変させる!?〜秋田の“鬼当ての母”松山恭子の紫微断易
https://contents.goodfortune.jp/kmo2/,Keiko的「ムーン・オラクル」〜月が導いた神秘の29枚〜
https://contents.goodfortune.jp/narusawa/,“白金の伝説占者”マダム成澤の誕生霊数〜当たり過ぎも困りものよ
https://contents.goodfortune.jp/epc/,転写パワーであなたの幸運細胞を揺さぶる！　エナジープロデュースカード
https://contents.goodfortune.jp/fujita/,仙家道術の秘儀を操る漢　藤田和久の八徳文殊波動玄術
https://contents.goodfortune.jp/chigumi/,精霊たちの囁きに鳥肌！　Chigumiのハワイアン・エレメンタル
https://contents.goodfortune.jp/gyoku/,本場台湾驚愕の厄払い！　悪霊も退散する鬼鑑定　玉仙妃の【靈符八神占】
https://contents.goodfortune.jp/lemurian/,心震える愛と癒しの奇跡【44枚の神の神秘】レムリアン・シード・オラクル
https://contents.goodfortune.jp/rie/,理想の未来を叶える占い師 山咲りえ ハンドコズミック数命術
https://contents.goodfortune.jp/kiko/,激ヤバッ!!　当たりすぎて「震えが止まらない」霊魂ダウザーKiko
https://contents.goodfortune.jp/mermaid/,愛、欲望、嫉妬、心の闇をさらけ出す魔性のカード【マーメイドオラクル】
https://contents.goodfortune.jp/luna/,ソウルメイトで話題！　引き寄せの女神☆ルナロジー創始者Keiko
https://contents.goodfortune.jp/aoki/,全国の占い学校から講演依頼殺到！◆青木智の極当占“十大主星占術”
https://contents.goodfortune.jp/miku/,限りある命の中で最大限の奇跡を起こす！未空流『命式陰陽術』
https://contents.goodfortune.jp/sugano/,「世界にただ一つの奇跡」菅野萌の“ツインレイリーディング”
https://contents.goodfortune.jp/ichild/,22枚の童話の世界が真実を告げる〜インナーチャイルドカード
https://contents.goodfortune.jp/shintaku/,日本の神託カード　〜神々と精霊、いのちと大地からのメッセージ〜
https://contents.goodfortune.jp/merisa/,負を浄化！《業界口コミ》騒然の魔術〜オルゴナイトリーディング
https://contents.goodfortune.jp/yuki/,読まれ過ぎ覚悟の極深占！　霊波リーダー結祈のペンデュラム占術
https://contents.goodfortune.jp/risui/,煌めきと幸福をもたらす“人生のみちびき師”鈴木理水の霊眼リーディング
https://contents.goodfortune.jp/klarale/,クラーラおばさんの《鉛数秘》〜古代の叡智が溢れる“幻”占術〜
https://contents.goodfortune.jp/macalon/,マカロンタロット〜可愛いけど本格派！　運命開く魔法のカード〜
https://contents.goodfortune.jp/aiga/,万物見極め真実晒す！　名古屋の行列占〜大須の母・相賀琉予〜
https://contents.goodfortune.jp/aqua/,人生の“負”を強制排除！ 驚異の《引き上げ》鑑定士“AQUA”
https://contents.goodfortune.jp/kirei/,運命切り開く至高の導き！　月星キレイのジュピテーショナル占術
https://contents.goodfortune.jp/pof/,KEIKOの「パートオブフォーチュン〜幸運のありか〜」
https://contents.goodfortune.jp/shokita/,諸喜田清子の波動宿綴占〜自動書記で綴り連なる運命の宿図
https://contents.goodfortune.jp/miesha/,日本最大占いイベント人気No.1占い師！　恋愛成就マスターmiesha
https://contents.goodfortune.jp/chiharu/,“心”貫く至高の感涙鑑定！木村衣晴ツインソウル・リーディング
https://contents.goodfortune.jp/takashima/,高島照令の『名乗り【ナノリ】』宿命鑑定
